{
  "$schema": "https://json-schema.org/draft/2020-12/schema",
  "$id": "https://github.com/axisosme/Axis/schemas/agent-activity/executor-agent-waiting-delivery.schema.json",
  "title": "Axis Executor Agent Waiting Delivery 1.0.0",
  "type": "object",
  "properties": {
    "contractVersion": { "const": "1.0.0" },
    "deliveryType": { "const": "executor_agent_waiting" },
    "envelope": { "$ref": "https://github.com/axisosme/Axis/schemas/runtime/executor-waiting-for-input-envelope.schema.json" },
    "agentActivity": { "$ref": "agent-activity-elicitation-receipt.schema.json#/$defs/elicitationReceipt" }
  },
  "required": ["contractVersion", "deliveryType", "envelope", "agentActivity"],
  "additionalProperties": false
}
