{
  "contractVersion": "1.0.0",
  "deliveryType": "executor_agent_waiting",
  "envelope": {
    "contractVersion": "1.0.0",
    "messageId": "fx-executor-waiting-1",
    "correlationId": "fx-corr-1",
    "operationId": "fx-op-1",
    "causationMessageId": "fx-executor-progressed-1",
    "occurredAt": "2026-09-05T00:00:00Z",
    "producer": "codex-adapter",
    "consumer": "worker",
    "envelopeType": "executor.waiting_for_input",
    "identity": {
      "contractVersion": "1.0.0",
      "task": {
        "contractVersion": "1.0.0",
        "taskId": "fx-task-1",
        "correlationId": "fx-corr-1",
        "sourceRef": {
          "system": "linear",
          "organizationId": "org-1",
          "issueId": "issue-1",
          "agentSessionId": "session-1"
        }
      },
      "attempt": {
        "contractVersion": "1.0.0",
        "attemptId": "fx-attempt-1",
        "taskId": "fx-task-1",
        "correlationId": "fx-corr-1"
      },
      "run": {
        "contractVersion": "1.0.0",
        "runId": "fx-run-1",
        "taskId": "fx-task-1",
        "attemptId": "fx-attempt-1",
        "sessionBindingId": "fx-binding-1",
        "correlationId": "fx-corr-1",
        "state": "waiting_for_input",
        "elicitation": {
          "decisionId": "fx-decision-1",
          "sourceEventId": "fx-event-1",
          "recommendedOptionId": "opt-a",
          "header": "Which approach?",
          "question": "Pick a path forward.",
          "options": [
            {
              "optionId": "opt-a",
              "replyValue": "a",
              "label": "Option A",
              "description": "Take approach A"
            },
            {
              "optionId": "opt-b",
              "replyValue": "b",
              "label": "Option B",
              "description": "Take approach B"
            }
          ],
          "other": {
            "optionId": "other",
            "replyValue": "other:"
          }
        }
      },
      "sessionBinding": {
        "contractVersion": "1.0.0",
        "sessionBindingId": "fx-binding-1",
        "taskId": "fx-task-1",
        "attemptId": "fx-attempt-1",
        "runId": "fx-run-1",
        "correlationId": "fx-corr-1",
        "workerId": "worker-1",
        "executorId": "codex-1"
      }
    },
    "elicitation": {
      "decisionId": "fx-decision-1",
      "sourceEventId": "fx-event-1",
      "recommendedOptionId": "opt-a",
      "header": "Which approach?",
      "question": "Pick a path forward.",
      "options": [
        {
          "optionId": "opt-a",
          "replyValue": "a",
          "label": "Option A",
          "description": "Take approach A"
        },
        {
          "optionId": "opt-b",
          "replyValue": "b",
          "label": "Option B",
          "description": "Take approach B"
        }
      ],
      "other": {
        "optionId": "other",
        "replyValue": "other:"
      }
    }
  },
  "agentActivity": {
    "contractVersion": "1.0.0",
    "activityId": "fx-activity-1",
    "taskId": "fx-task-1",
    "attemptId": "fx-attempt-1",
    "runId": "fx-run-1",
    "conversation": {
      "system": "linear",
      "agentSessionId": "session-1"
    },
    "sourceEventId": "fx-event-1",
    "operationId": "fx-op-1",
    "elicitation": {
      "decisionId": "fx-decision-1",
      "sourceEventId": "fx-event-1",
      "recommendedOptionId": "opt-a",
      "header": "Which approach?",
      "question": "Pick a path forward.",
      "options": [
        {
          "optionId": "opt-a",
          "replyValue": "a",
          "label": "Option A",
          "description": "Take approach A"
        },
        {
          "optionId": "opt-b",
          "replyValue": "b",
          "label": "Option B",
          "description": "Take approach B"
        }
      ],
      "other": {
        "optionId": "other",
        "replyValue": "other:"
      }
    }
  }
}
